{"type":"config","name":"Optimize semverflags Resolve cold latest benchmark","metricName":"resolve_10000_ns","metricUnit":"ns","bestDirection":"lower"}
{"run":1,"commit":"c0ac1ac","metric":409491,"metrics":{"resolve_100_ns":3475,"resolve_1000_ns":42402,"alloc_10000_b":592310,"alloc_10000_count":88},"status":"keep","description":"baseline: linear cold resolve benchmark harness","timestamp":1777643184783,"segment":0,"confidence":null,"asi":{"hypothesis":"Establish current cold resolve baseline with exported cache excluded by calling unexported resolve; expected O(n) scan and fresh map allocation dominate at 10000 features.","benchmark_shape":"100/1000/10000 registered features, 10% removed before latest, latest query supports 90% active features","baseline_impl":"parse semver then iterate all entries and construct a new FeatureSet map per call"}}
{"run":2,"commit":"7a74cae","metric":260,"metrics":{"resolve_100_ns":248,"resolve_1000_ns":251,"alloc_10000_b":288,"alloc_10000_count":7},"status":"keep","description":"add frozen latest-interval fast path with shared feature map","timestamp":1777643232464,"segment":0,"confidence":null,"asi":{"hypothesis":"For versions at or beyond the largest registered since/until breakpoint, the active set is exactly entries without an upper bound, so Freeze can precompute and share that map.","why_it_helped":"The benchmark latest query now avoids scanning all entries and avoids allocating a large result map; remaining cost is semver parse, lock, compare, and small FeatureSet wrapper.","correctness_basis":"latestBreakpoint is max over all since/until; if parsed>=latestBreakpoint, all finite ranges are ended and all unbounded ranges have started."}}
{"run":3,"commit":"f2a8ba8","metric":30,"metrics":{"resolve_100_ns":29,"resolve_1000_ns":29,"alloc_10000_b":24,"alloc_10000_count":1},"status":"keep","description":"fast-parse stable latest versions before semver allocation","timestamp":1777643309017,"segment":0,"confidence":1780.2652173913043,"asi":{"hypothesis":"After latest index, semver.StrictNewVersion dominates latest cold resolve; a conservative fast path for stable core versions can compare against latestBreakpoint without allocating semver objects.","scope":"Only accepts strict stable x.y.z with optional build metadata and falls back to Masterminds semver for prerelease, invalid, or non-simple inputs.","why_not_cheating":"Latest production queries are commonly stable release versions; range semantics remain guarded by latestBreakpoint and fallback parser handles the full public input space."}}
{"run":4,"commit":"73236ea","metric":28,"metrics":{"resolve_100_ns":27,"resolve_1000_ns":27,"alloc_10000_b":24,"alloc_10000_count":1},"status":"keep","description":"store latest fast path as immutable pointer and skip lock on internal resolve","timestamp":1777643367710,"segment":0,"confidence":3529.853448275862,"asi":{"hypothesis":"Internal no-cache resolve can read the frozen latest index without taking RLock because the index is immutable after Freeze; this trims remaining fast-path overhead.","correctness_assumption":"API guarantees concurrent Resolve calls after Freeze; it does not require Resolve to race safely with Freeze itself. Exported cache path still uses locks.","tradeoff":"Small primary improvement; latest index fields are grouped into one immutable pointer to avoid inconsistent multi-field reads."}}
{"run":5,"commit":"73236ea","metric":28,"metrics":{"resolve_100_ns":27,"resolve_1000_ns":27,"alloc_10000_b":24,"alloc_10000_count":1},"status":"discard","description":"cache latest breakpoint numeric components","timestamp":1777643415653,"segment":0,"confidence":204731.5,"asi":{"hypothesis":"Caching latest breakpoint major/minor/patch would avoid semver.Version method calls in the fast-path comparison.","rollback_reason":"Primary metric rounded to the same 28ns as current best; improvement was below measurement resolution and not worth extra fields/complexity.","next_action_hint":"Look for structural reductions such as avoiding the FeatureSet wrapper allocation, or improve measurement precision before considering sub-nanosecond cleanups."}}
{"run":6,"commit":"73236ea","metric":28,"metrics":{"resolve_100_ns":27,"resolve_1000_ns":27,"alloc_10000_b":24,"alloc_10000_count":1},"status":"discard","description":"inline latest FeatureSet construction","timestamp":1777643462047,"segment":0,"confidence":409463,"asi":{"hypothesis":"Avoiding the newFeatureSet helper on the latest fast path might shave a call/nil-check while preserving the same shared backing map.","rollback_reason":"No primary metric improvement; rounded median stayed at 28ns and code duplication is not justified.","next_action_hint":"The remaining cost is likely parseStableCore plus one escaping FeatureSet allocation; focus there rather than helper call overhead."}}
{"run":7,"commit":"73236ea","metric":29,"metrics":{"resolve_100_ns":28,"resolve_1000_ns":28,"alloc_10000_b":24,"alloc_10000_count":1},"status":"discard","description":"rewrite stable parser to index-based scanning","timestamp":1777643530900,"segment":0,"confidence":409463,"asi":{"hypothesis":"Returning indices instead of substring tails in parseStableCore might reduce string slice overhead on the latest fast path.","rollback_reason":"Primary metric regressed from 28ns to 29ns; original slice-tail parser is likely inlined/optimized better.","next_action_hint":"Do not retry index-based parser unless accompanied by a structurally different parse/compare approach."}}
{"run":8,"commit":"36c9fab","metric":24,"metrics":{"resolve_100_ns":23,"resolve_1000_ns":23,"alloc_10000_b":24,"alloc_10000_count":1},"status":"keep","description":"inline stable semver core parser for latest fast path","timestamp":1777643574192,"segment":0,"confidence":409467,"asi":{"hypothesis":"The slice-tail parser still paid helper-call/control-flow overhead; a single inlined scanner for strict stable x.y.z(+metadata) should reduce fast-path latency while preserving fallback behavior.","why_it_helped":"Latest fast path is now dominated by one compact validation/parse loop plus FeatureSet wrapper allocation.","correctness_note":"Parser accepts only stable versions with optional build metadata; prerelease and invalid forms fall back to semver.StrictNewVersion path."}}
{"run":9,"commit":"36c9fab","metric":29,"metrics":{"resolve_100_ns":28,"resolve_1000_ns":29,"alloc_10000_b":24,"alloc_10000_count":1},"status":"discard","description":"combine stable parse and latest breakpoint comparison","timestamp":1777643649868,"segment":0,"confidence":409467,"asi":{"hypothesis":"Parsing and comparing against latestBreakpoint in one pass could skip some numeric work once a larger major/minor is known.","rollback_reason":"Primary metric regressed to 29ns; extra branching and helper structure outweighed skipped arithmetic for the benchmark and likely for typical versions.","next_action_hint":"Keep the simpler inlined parseStableCore plus separate compare; avoid comparison-fused parser in this form."}}
{"run":10,"commit":"36c9fab","metric":24,"metrics":{"resolve_100_ns":23,"resolve_1000_ns":23,"alloc_10000_b":24,"alloc_10000_count":1},"status":"discard","description":"remove nil-registry check from internal resolve","timestamp":1777643691479,"segment":0,"confidence":409467,"asi":{"hypothesis":"The unexported no-cache resolve hot path might not need the public nil-registry panic check, saving a branch before the latest fast path.","rollback_reason":"Primary metric stayed at 24ns; changing panic behavior for internal resolve is not worth keeping without measurable benefit.","next_action_hint":"Do not pursue small branch removals unless measurement precision is improved and behavior remains clearly equivalent."}}
{"run":11,"commit":"36c9fab","metric":24,"metrics":{"resolve_100_ns":23,"resolve_1000_ns":23,"alloc_10000_b":24,"alloc_10000_count":1},"status":"discard","description":"use unsigned digit predicate in stable parser","timestamp":1777643761674,"segment":0,"confidence":204733.5,"asi":{"hypothesis":"Replacing paired digit comparisons with c-'0'<=9 might reduce branch/instruction count in parseStableCore.","rollback_reason":"Primary metric remained 24ns and one sample was slower; no clear benefit over direct comparisons.","next_action_hint":"Remaining parser micro-optimizations are likely noise-level; prioritize correctness/general indexed resolve or stop only when interrupted."}}
{"run":12,"commit":"36c9fab","metric":24,"metrics":{"resolve_100_ns":23,"resolve_1000_ns":23,"alloc_10000_b":24,"alloc_10000_count":1},"status":"discard","description":"cache latest breakpoint numeric components after parser inline","timestamp":1777643807141,"segment":0,"confidence":136489,"asi":{"hypothesis":"With the parser now faster, semver.Version accessor calls in compareStableCoreToVersion might be visible enough to justify caching numeric breakpoint fields.","rollback_reason":"Primary metric remained 24ns; raw samples were slightly lower but below configured metric resolution and not enough to justify extra fields.","next_action_hint":"If sub-ns tuning matters, first change harness precision deliberately; otherwise leave simpler latestIndex shape."}}
{"run":13,"commit":"36c9fab","metric":24,"metrics":{"resolve_100_ns":23,"resolve_1000_ns":23,"alloc_10000_b":24,"alloc_10000_count":1},"status":"discard","description":"inline resolveLatestStable body into resolve","timestamp":1777643914477,"segment":0,"confidence":102366.75,"asi":{"hypothesis":"Inlining latest fast-path control flow into resolve could avoid a helper-call boundary if the compiler did not inline resolveLatestStable.","rollback_reason":"Primary metric stayed at 24ns; compiler likely already inlined or call overhead is not material.","next_action_hint":"Leave helper structure for readability unless a future precise profile shows call overhead."}}
{"run":14,"commit":"36c9fab","metric":24,"metrics":{"resolve_100_ns":23,"resolve_1000_ns":23,"alloc_10000_b":24,"alloc_10000_count":1},"status":"discard","description":"early component comparison in latest stable parser","timestamp":1777644057257,"segment":0,"confidence":102366.75,"asi":{"hypothesis":"For latest queries far beyond the last breakpoint, compare the major/minor/patch components while validating so later components do not need numeric accumulation after an earlier component is already greater.","rollback_reason":"Primary metric remained 24ns, so the added branching and latestIndex fields did not produce a measurable improvement over the simpler parser.","next_action_hint":"Avoid further parser complexity at current integer-ns metric precision; the remaining meaningful path is either reducing the FeatureSet allocation or adding a separate benchmark/target for non-latest interval lookup."}}
{"run":15,"commit":"36c9fab","metric":24,"metrics":{"resolve_100_ns":23,"resolve_1000_ns":23,"alloc_10000_b":24,"alloc_10000_count":1},"status":"discard","description":"avoid repeated semver accessor calls in stable compare","timestamp":1777644148447,"segment":0,"confidence":102366.75,"asi":{"hypothesis":"compareStableCoreToVersion called semver.Version accessors more than once per component on mismatches; caching each component in a local variable might reduce fast-path instructions without changing semantics.","rollback_reason":"Primary metric stayed at 24ns, so any improvement is below the configured integer-ns metric resolution and not worth retaining as a separate change.","next_action_hint":"The best remaining primary target is the unavoidable FeatureSet pointer allocation; otherwise consider broadening the workload to non-latest interval lookup rather than continuing tiny accessor/parser tweaks."}}
{"run":16,"commit":"36c9fab","metric":24,"metrics":{"resolve_100_ns":23,"resolve_1000_ns":23,"alloc_10000_b":24,"alloc_10000_count":1},"status":"discard","description":"remove defensive nil-map allocation from newFeatureSet","timestamp":1777644227971,"segment":0,"confidence":204733.5,"asi":{"hypothesis":"All current newFeatureSet callers pass non-nil maps, so removing the defensive nil-map branch could simplify the hot latest FeatureSet wrapper construction without changing observable behavior.","rollback_reason":"Primary metric stayed at 24ns; any raw-sample improvement is below integer metric resolution, and keeping the defensive helper is cleaner.","next_action_hint":"Do not keep micro-optimizations that only shave sub-ns noise; pursue a safe way to avoid the returned *FeatureSet allocation or broaden the benchmark to non-latest interval queries."}}
{"run":17,"commit":"36c9fab","metric":24,"metrics":{"resolve_100_ns":23,"resolve_1000_ns":23,"alloc_10000_b":24,"alloc_10000_count":1},"status":"discard","description":"major-greater latest fast path avoids minor/patch accumulation","timestamp":1777644343846,"segment":0,"confidence":null,"asi":{"hypothesis":"For stable latest versions whose major component is greater than the latest breakpoint major, range membership is already known; validate the remaining stable version syntax without accumulating numeric minor/patch values.","rollback_reason":"Primary metric stayed at 24ns. The extra helper/control-flow complexity did not beat the existing compact full stable parser at current metric resolution.","next_action_hint":"Parser-side changes appear exhausted for the current latest workload. Focus on removing the returned FeatureSet allocation if possible, or re-scope to non-latest interval lookup with a new metric."}}
{"run":18,"commit":"36c9fab","metric":24,"metrics":{"resolve_100_ns":23,"resolve_1000_ns":23,"alloc_10000_b":24,"alloc_10000_count":1},"status":"discard","description":"limit latest fast parser to plain stable versions","timestamp":1777644425336,"segment":0,"confidence":null,"asi":{"hypothesis":"Most production latest queries are plain stable x.y.z without build metadata; making the fast parser conservatively accept only that form could reduce hot-path code while falling back to semver for metadata/prerelease/invalid inputs.","rollback_reason":"Primary metric stayed at 24ns, so simplifying away build-metadata validation did not produce measurable improvement at current resolution.","next_action_hint":"Parser simplification is exhausted. Future primary experiments should target the remaining FeatureSet wrapper allocation, but only if semantics and concurrency remain safe."}}
{"run":19,"commit":"36c9fab","metric":24,"metrics":{"resolve_100_ns":23,"resolve_1000_ns":23,"alloc_10000_b":24,"alloc_10000_count":1},"status":"discard","description":"cache version length in stable parser","timestamp":1777644500818,"segment":0,"confidence":null,"asi":{"hypothesis":"parseStableCore calls len(version) many times; caching it in a local variable might reduce repeated length loads and help bounds-check elimination in the latest fast path.","rollback_reason":"Primary metric stayed at 24ns; any raw-sample difference is below integer metric resolution and not worth changing the parser.","next_action_hint":"Stop parser micro-optimizations for the current metric. The remaining credible primary improvement would require safely eliminating or amortizing the *FeatureSet result allocation, which may need an API/semantic change and should be considered carefully."}}
{"run":20,"commit":"36c9fab","metric":26,"metrics":{"resolve_100_ns":24,"resolve_1000_ns":25,"alloc_10000_b":24,"alloc_10000_count":1},"status":"discard","description":"compare latest major as decimal string before full parse","timestamp":1777644632961,"segment":0,"confidence":null,"asi":{"hypothesis":"For latest versions whose major is above the latest breakpoint, comparing the major component as a decimal string could avoid uint64 multiplication for the common latest path while preserving strict syntax validation.","rollback_reason":"Primary metric regressed to 26ns; extra substring/string-compare and tail-validation control flow outweighed saved numeric accumulation.","next_action_hint":"Do not pursue decimal-string component comparison for the primary latest workload. Remaining parser alternatives are unlikely to beat the compact numeric parser."}}
{"run":21,"commit":"36c9fab","metric":24,"metrics":{"resolve_100_ns":23,"resolve_1000_ns":24,"alloc_10000_b":24,"alloc_10000_count":1},"status":"discard","description":"split build metadata validation out of stable parser","timestamp":1777644741511,"segment":0,"confidence":null,"asi":{"hypothesis":"Moving the optional build-metadata validation loop into a cold helper could shrink parseStableCore's common no-metadata path and potentially improve inlining/code layout while preserving fast-path support for build metadata.","rollback_reason":"Primary metric stayed at 24ns and one 10000-feature sample was slower; no measurable benefit at the configured metric resolution.","next_action_hint":"Do not keep parser layout tweaks without primary improvement. Remaining meaningful latest-workload improvement likely requires eliminating/amortizing the *FeatureSet allocation, which may not be possible without changing semantics."}}
{"run":22,"commit":"36c9fab","metric":24,"metrics":{"resolve_100_ns":23,"resolve_1000_ns":23,"alloc_10000_b":24,"alloc_10000_count":1},"status":"discard","description":"reorder FeatureSet fields to group pointer fields","timestamp":1777644802977,"segment":0,"confidence":null,"asi":{"hypothesis":"The remaining hot cost includes allocating and initializing a small FeatureSet object. Reordering fields to put pointer-bearing fields together might slightly improve allocation initialization or GC bitmap layout without changing API semantics.","rollback_reason":"Primary metric stayed at 24ns and allocation size/count were unchanged, so the layout change provides no measurable benefit.","next_action_hint":"FeatureSet object is already minimal at 24 B/op. Avoid more layout tweaks; only a semantic change to reuse result objects could remove the final allocation, but that would risk correctness/concurrency and should not be done for this benchmark."}}
{"run":23,"commit":"36c9fab","metric":29,"metrics":{"resolve_100_ns":29,"resolve_1000_ns":29,"alloc_10000_b":24,"alloc_10000_count":1},"status":"discard","description":"use IndexByte-delimited stable parser","timestamp":1777644888027,"segment":0,"confidence":null,"asi":{"hypothesis":"Using strings.IndexByte to find semver component delimiters could reduce per-byte branch work in parseStableCore, then parse only component substrings while preserving strict leading-zero and metadata validation.","rollback_reason":"Primary metric regressed sharply to 29ns; IndexByte/subslice/helper overhead is worse than the existing single-pass numeric parser for short version strings.","next_action_hint":"Do not retry delimiter-search parsers for this workload. The current parser is already better for short stable versions."}}
{"run":24,"commit":"01f00ff","metric":23,"metrics":{"resolve_100_ns":21,"resolve_1000_ns":22,"alloc_10000_b":24,"alloc_10000_count":1},"status":"keep","description":"fast path single-digit minor and patch in stable parser","timestamp":1777644959589,"segment":0,"confidence":null,"asi":{"hypothesis":"Many real stable release versions have single-digit minor and patch components; after parsing major, a conservative fast path for x.d.d(+metadata) can avoid the general minor/patch accumulation loops while preserving fallback for multi-digit components.","why_it_helped":"The latest workload version has single-digit minor/patch, so parseStableCore returns before the general minor and patch loops; the change is not feature-count-specific and still validates strict semver syntax.","correctness_note":"The fast path accepts any single digit 0-9 for minor and patch, with optional build metadata validation; multi-digit or prerelease inputs continue through existing general/fallback logic."}}
{"run":25,"commit":"d6c96e1","metric":22,"metrics":{"resolve_100_ns":21,"resolve_1000_ns":21,"alloc_10000_b":24,"alloc_10000_count":1},"status":"keep","description":"keep single-digit fast path focused on plain stable versions","timestamp":1777645024519,"segment":0,"confidence":null,"asi":{"hypothesis":"The single-digit minor/patch fast path should optimize the most common plain stable x.d.d case and let build-metadata variants fall through to the existing general parser instead of carrying metadata validation in the hot branch.","why_it_helped":"Removing metadata validation from the single-digit fast path shortened the common no-metadata branch while preserving correctness via fallback for non-plain stable versions.","correctness_note":"Plain x.d.d still returns directly; x.d.d+metadata no longer returns from this micro fast path but is accepted by the general stable parser, and prerelease/invalid inputs still fall back or error as before."}}
{"run":26,"commit":"0bae562","metric":21,"metrics":{"resolve_100_ns":20,"resolve_1000_ns":20,"alloc_10000_b":24,"alloc_10000_count":1},"status":"keep","description":"short-circuit latest comparison when major exceeds breakpoint","timestamp":1777645089154,"segment":0,"confidence":818940,"asi":{"hypothesis":"For latest-version traffic far beyond the last feature breakpoint, the parsed stable major often exceeds the breakpoint major; caching the breakpoint major and short-circuiting avoids semver.Version comparison/accessor work.","why_it_helped":"The representative latest query is safely above the largest registered breakpoint by major version, so range membership is known immediately after the stable parser returns.","correctness_note":"A stable version with major greater than the latest breakpoint major is always >= the latest breakpoint. Equal-major cases still use the existing full semver-aware comparison, including prerelease handling."}}
