{"run":27,"commit":"0bae562","metric":21,"metrics":{"resolve_100_ns":20,"resolve_1000_ns":21,"alloc_10000_b":24,"alloc_10000_count":1},"status":"discard","description":"parse major first and validate tail for high-major latest versions","timestamp":1777645187833,"segment":0,"confidence":409470,"asi":{"hypothesis":"When the parsed stable major is greater than the latest breakpoint, resolveLatestStable only needs to validate the remaining stable version syntax and can avoid parsing numeric minor/patch values entirely.","rollback_reason":"Primary metric stayed at 21ns; the saved minor/patch numeric work was offset by extra helper/control-flow overhead compared with the current compact single-digit fast path.","next_action_hint":"Keep the existing parseStableCore plus major short-circuit. Further high-major parser splitting is unlikely to improve the current primary metric."}}
{"run":28,"commit":"0bae562","metric":21,"metrics":{"resolve_100_ns":20,"resolve_1000_ns":20,"alloc_10000_b":24,"alloc_10000_count":1},"status":"discard","description":"seed major parser with first digit","timestamp":1777645249173,"segment":0,"confidence":272980,"asi":{"hypothesis":"parseStableCore currently loops over the first major digit after already validating it; seeding the major accumulator from the first digit and starting the loop at index 1 could reduce work for all stable versions while preserving leading-zero rules.","rollback_reason":"Primary metric remained 21ns, equal to current best under the configured integer-ns metric; raw samples were slightly lower but below decision resolution.","next_action_hint":"If sub-ns parser improvements matter, first improve metric precision. Under current rules, focus only on changes that move the rounded primary below 21ns or broaden the benchmark target."}}
{"run":29,"commit":"0bae562","metric":21,"metrics":{"resolve_100_ns":20,"resolve_1000_ns":20,"alloc_10000_b":24,"alloc_10000_count":1},"status":"discard","description":"collapse single-digit stable suffix fast path","timestamp":1777645317271,"segment":0,"confidence":204735,"asi":{"hypothesis":"After parsing major, detect the common plain stable suffix .d.d in one combined condition to reduce branches and index arithmetic compared with the existing nested single-digit minor/patch fast path.","rollback_reason":"Primary metric remained 21ns, equal to current best; raw samples were slightly slower than the best kept run, so the branch layout change is not beneficial.","next_action_hint":"The current nested single-digit fast path is already efficient. Future attempts should target a different bottleneck, such as result allocation or a broader non-latest interval benchmark."}}
{"run":30,"commit":"65fadd9","metric":20,"metrics":{"resolve_100_ns":19,"resolve_1000_ns":19,"alloc_10000_b":24,"alloc_10000_count":1},"status":"keep","description":"inline high-major plain single-digit latest path before full parser","timestamp":1777645395190,"segment":0,"confidence":204735.5,"asi":{"hypothesis":"For latest traffic far above the breakpoint with plain x.d.d stable versions, resolveLatestStable can validate the high-major single-digit suffix before invoking the full stable parser, avoiding the general parser entirely on that common path.","why_it_helped":"The representative query is a high-major plain stable x.0.0 version, so the fast path returns after scanning major and checking a compact .d.d suffix.","correctness_note":"The shortcut only accepts strict non-leading-zero major plus plain single-digit minor/patch and only when major exceeds the latest breakpoint; all other valid/invalid forms fall through to the existing parser and semver fallback."}}
